job_title,company,description,job_url,keywords_present,page_found
Sr Software Engineer - Machine Learning,Pearson,"**Description**

At Pearson, we’re committed to a world that’s always learning and to our talented team who makes it all possible. From bringing lectures vividly to life to turning textbooks into laptop lessons, we are always re-examining the way people learn best, whether it’s one child in our own backyard or an education community across the globe. We are bold thinkers and standout innovators who motivate each other to explore new frontiers in an environment that supports and inspires us to always be better. By pushing the boundaries of technology — and each other to surpass these boundaries — we create seeds of learning that become the catalyst for the world’s innovations, personal and global, large and small.

The Personalized Learning and Analytics team (PLA) in Pearson is responsible for software development of analytics and machine learning platforms. PLA is growing and we are looking for a new team member to help build a machine learning solution for Pearson’s Global Learning Platform (GLP). Together with a highly multi-disciplinary team of engineers, data scientists, strategic partners, product managers and subject domain experts you will work on building adaptive solutions powered by big data. You will work on a best-in-class cloud computing platform, with cutting edge big data tools at your disposal while having access to experts in education, learning design, engineering and data science.

Pearson is an Equal Opportunity and Affirmative Action Employer, and a member of E-Verify. All qualified applicants, including minorities, women, veterans, and people with disabilities are encouraged to apply.

Responsibilities:
+ Design, code, unit test, and deploy multi-tenant, highly available software components using a variety of open-source technologies

+ Work closely with other engineers and data scientists to build, test, deploy and troubleshoot machine learning / algorithm based software

+ Develop scalable data processing pipelines

+ Actively participates in architecture and design meetings

+ Collaborate with other engineers and data scientists to find effective solutions to technical challenges

+ Enjoy a healthy technical debate but know how to collaboratively solve problems that move everyone forward

+ Improve and maintain internal monitoring, instrumentation, and overall visibility of our learning systems

+ Be self-directed and be able to prioritize your own workload

+ Be willing to learn new skills whether they are directly tied to software development, software testing, data science, analytics, server maintenance, or web application release and delivery

**Qualifications**

Qualifications:
+ The ideal candidate will be detail oriented, self-directed, self-motivated, with a strong capacity for working successfully and flexibly with members across the organization

+ BS or higher in computer science or equivalent experience.

+ 5 years of core Java development experience

+ Experience and practice with Java Unit testing frameworks

+ Experience with microservice infrastructure

+ Experience with Unix / Linux based systems

+ Experience and interest working in cloud computing platforms such as AWS

+ Experience with Maven, Jenkins, and CI/CD platforms

+ Desire to explore and develop solutions to questions that may or may not have a right answer

+ Passion for learning (new problem domains, algorithms, tools etc) and for analyzing data

+ Good communications skills and the ability to communicate with a variety of internal and external development groups

+ Ability to access, manage, transfer, integrate and analyze complex datasets, using platforms like Spark.

Bonus Qualifications:
+ Good understanding of foundational statistics concepts and algorithms: linear/logistic regression, random forest, boosting, NNs, etc.

+ Familiarity with libraries such as Spark ML, Tensor flow, scikit-learn, MLib, DLib, Pandas, etc.

+ Fluency with Scala functional programming

+ Familiarity with Python

Pearson is an Equal Opportunity and Affirmative Action Employer and a member of E-Verify. All qualified applicants, including minorities, women, protected veterans, and individuals with disabilities are encouraged to apply.

**Primary Location: ** US-CO-Centennial

**Work Locations: ** US-CO-Centennial-2154 East Commons 2154 East Commons Avenue Centennial 80122

**Job: ** Technology

**Organization: ** Technology & Operations

**Employee Status: ** Regular Employee

**Job Type: ** Standard

**Shift: ** Day Job

**Job Posting: ** Nov 12, 2019

**Job Unposting: ** Ongoing

**Schedule: ** Full-time Regular

**Req ID: ** 1914298

Pearson is an Equal Opportunity and Affirmative Action Employer and a member of E-Verify. All qualified applicants, including minorities, women, protected veterans, and individuals with disabilities are encouraged to apply.",https://www.indeed.com/viewjob?jk=7050c44843e63ed6&from=serp&vjs=3,,22
Senior Data Analyst,Rentokil Steritech,"Overview
Senior Data Analyst

Steritech is the market leader in food safety, quality assurance, and customer experience management. We pride ourselves on being a trusted partner to many of the world’s leading brands across industries as diverse as manufacturing, processing, retail, food service, and hospitality. We help our clients give the best, safest, and healthiest possible service to THEIR customers.

Not to mention…
World-class training of the latest food safety and customer service best practices
Coaching/mentoring and career advancement opportunities
Great benefits - Medical, Dental, and Vision, Employer-matched 401(k)
Paid vacation, holidays, and PTO days

The Senior Data Analyst (SDA) is a position on the Analytics Team reporting to the Director, Insights & Analytics.
The Senior Data Analyst position has the following responsibilities included in the Data Analyst Position.
The DA has primary responsibility for analyzing client data for specific insights that will enable the client to make better business decisions.

Examples of these types of analyses include:
Evaluation of assessment results for predictive/prescriptive analytics,
Correlation of assessment results to outside data sources,
Comparison of assessment data to results from a given client’s peer group,
Analysis of factors associated with assessment results to determine specific relationships,
Monitoring Specialist metrics to advise the client team on potential concerns, and
Routinely advising on adherence to specific service level agreements.
 The DA role is client facing, and may require attendance and presentations at business reviews and other client or internal meetings in order to strengthen the relationship with the customer. The DA will work closely with the rest of the client team to ensure seamless communication and delivery of results.
In addition, the Data Analyst must develop an in-depth understanding of the Brand Standards business, Steritech protocols and procedures and specific customer brand requirements to ensure a high level of service to the client and to facilitate excellent communication between Steritech and all levels of the client organization.
Additionally the Senior Data Analyst role will have responsibility for the development of embedded Qlik reports for internal and external customers. This will include:
Working closely with internal/external customers to identify requirements
Writing SQL code for database queries
Developing the reports in Qlik
Embedding the reports in OnBrand
Testing/QA of reports
On-going maintenance of reports.
Responsibilities
ESSENTIAL DUTIES AND RESPONSIBILITIES

Interpret data, analyze results using statistical techniques and provide ongoing reports
Proficiency with spreadsheet applications, including Excel.
Extrapolation of data patterns to derive meaningful results. Ability to create visualizations that clearly illustrate results for non-technical personnel
Ability to clearly communicate complex analysis to non-technical personnel both verbally and in written forms
Must display critical thinking skills, including the ability to assess numbers, trends, and data in order to reach new conclusions based on the findings
Develop and maintain and in-depth knowledge of the market segment, sharing insights, trends, benchmarking and best practices with clients assigned
Proactively assesses company performance on quality, calibration, round spread, day-parting, survey results, Specialist feedback and manages SLAs
Suggests new methods of data capture, analysis and reporting to provide continuous improvement and value to clients served
Able to interface closely with internal/external clients to identify the requirements for embedded Qlik reports
SQL database query capabilities
Qlik dashboard and reporting knowledge and skill
Proactively assesses, clarifies, validates customer needs and adds value to customers programs on an ongoing basis.
Establishes productive, professional and consultative relationships with key personnel throughout assigned client organizations (at both the franchise and corporate level).
Performs all other duties as assigned.

BASIC QUALIFICATIONS

The requirements listed below are representative of the knowledge, skill, ability and/or background required.
Must have a Bachelor’s Degree in data science or a related field or three years progressive experience in a data analysis role
Must be a self-starter with the ability to perform independently in high pressure and dynamic situations with skill and tact
Demonstrated ability to execute on projects and initiatives
Excellent communication skills, both verbal and written
Ability to demonstrate data analysis skill and ability to apply this to business situations
Attention to detail.
Sound decision making skills.
Desire and ability to travel via car and airplane to meet clients, field operations, attend meetings and conference as necessary (10% travel potential)
Proficiency with Google applications (docs, sheets, calendar, drive, etc.).
Must pass pre-employment background screenings (DMV, criminal, drug).

PREFERRED QUALIFICATIONS
Minimum two years of data analysis experience
Proficiency with Business Intelligence Tools such as Power BI, Tableau and QlikView
Experience in the (foodservice/grocery/convenience/QSR) industry

PHYSICAL DEMANDS

Reasonable accommodations may be made to enable individuals with disabilities to perform essential duties.
Passenger car, telephone, personal computer, other general office equipment
Walking, standing, squatting, kneeling, sitting, driving, seeing, communicating (orally & in writing).
Additional Information
We are Proudly an Equal Opportunity Employer!
EOE AA M/F/Vet/Disability

Link to Federal employment poster:
http://www1.eeoc.gov/employers/upload/eeoc_self_print_poster.pdf


Pay Transparency Nondiscrimination Provision

https://www.dol.gov/ofccp/pdf/pay-transp_formattedESQA508c.pdf",https://www.indeed.com/viewjob?jk=53e2118332b1d88a&from=serp&vjs=3,,16
CIRES/ EARTH LAB Machine Learning Applications to Earth Observations of Natural Hazards Post-Doc,University of Colorado Boulder,"Job Summary
Earth Lab, funded by the University of Colorado Boulder’s “Grand Challenge: Our Space, Our Future” and part of CIRES, seeks post-doctoral researchers to join a dynamic team pushing the frontiers of coupled Earth and social system science (http://www.colorado.edu/earthlab/). Earth Lab’s mission is to harness the data revolution through research, analytics, and education to accelerate understanding of global environmental change to help society better manage and adapt.

Earth Lab is seeking a Post-Doctoral Research Scholar to lead a research agenda in the following area: Machine Learning Applications to Earth Observations of Natural Hazards. This targeted research area represents Earth Lab’s efforts to explore natural and social system vulnerability and resilience to global environmental change, while also capitalizing of the diversity of data available to generate new insights. All postdoc positions are for one year with the possibility of extension based on performance and funding availability.

Earth Lab seeks a Postdoctoral Research Scholar to advance machine learning applications in analyzing and integrating Earth observations, and non-traditional data sources - like Twitter or Zillow - to better understand global change and the consequences to ecosystems and society. This candidate will push forward on research frontiers that are emerging as methodological tools from the deep learning revolution spillover into the Earth and environmental sciences. These include applications of generative models, generative adversarial networks, self-supervised or semi-supervised learning for sparse data, transfer learning, reinforcement learning, and science-based deep learning that combines dynamical or physical models with neural networks. The candidate chosen for this position would have flexibility in terms of the particular systems, questions, and machine learning methods that are studied. Example research topics include:
Benefits of super-resolution techniques applied to satellite imagery assessed by classification accuracy, unmixing ratios, and/or physical process modeling.
Combining co-located point cloud data (e.g., structure from motion) with RGB, multispectral and thermal imagery for surface characterization.
Integration of commercial satellite imagery with long-term NASA and USGS research satellite observations (off-nadir view angles, inconsistent radiometry)
Real-time disaster response support that integrates disparate streams of observations including remotely sensed and social media data.
Science-based deep learning that permits inference about dynamical models and facilitates prediction.
Reinforcement learning to evaluate optimal control of wildfires.
Self-supervised learning for plant classification from hyperspectral imagery.
Scalable Bayesian deep learning for earth science applications that accommodates parameter uncertainty (e.g., variational inference).
The research goal of this work is to advance our understanding of some aspect of:
Predictive inference in support of real time, short term, and/or long term prediction.
Object detection, segmentation, or classification of remotely sensed observations that leverages convolutional neural networks with limited training data.
Development of key Earth science training datasets to support future work.
Use of cloud computing resources to scale analytics.
Natural hazards, extreme events, and global change using multiple streams of information.
Who We Are
At CIRES, the Cooperative Institute for Research in Environmental Sciences, more than 800 environmental scientists work to understand the dynamic Earth system, including people’s relationship with the planet. CIRES is a partnership of NOAA and the University of Colorado Boulder, and our areas of expertise include weather and climate, changes at the Earth’s poles, air quality and atmospheric chemistry, water resources, and solid Earth sciences. Our vision is to be instrumental in ensuring a sustainable future environment by advancing scientific and societal understanding of the Earth system.

https://cires.colorado.edu/

Earth Lab, funded by the University of Colorado Boulder’s “Grand Challenge: Our Space, Our Future” and part of CIRES, seeks post-doctoral researchers to join a dynamic team pushing the frontiers of coupled Earth and social system science (http://www.colorado.edu/earthlab/). Earth Lab’s mission is to harness the data revolution through research, analytics, and education to accelerate understanding of global environmental change to help society better manage and adapt.
What Your Key Responsibilities Will Be
Work with individual team to meet research goals of this position, with the expectation of submitting one manuscript for publication to a peer-reviewed journal by the end of Year 1, and contribute to and/or submit an independent funding proposal.
Use research agenda to develop use cases for the Analytics Hub (staff and Viz-studio) with heterogeneous and/or big data streams that require specialized data management, analysis, and/or visualization support (with emphasis on data from the Earth Observation enterprise, from ground-based to space-based sensors).
Contribute to discussions with industry, federal, and other academic partners, and contribute to opportunities to make Earth Lab visible in the community.
Contribute to the open, reproducible science objectives of Earth Lab. This could include contributing or publishing well-documented data sets or code recipes that could serve multiple users within Earth Lab or other audiences.
Work on synergistic activities across the post-doc cohort and Science Teams. This could include collaboration on external proposals, papers, workshops, opportunities with industry/federal partners, or other collaborative activity and should amount to 20% effort.

What You Should Know
This position is located at the University of Colorado at Boulder's main campus.
All postdoc positions are for one year with the possibility of extension based on performance and funding availability.
To learn more about Earth Lab, visit Earth Lab’s website (http://www.colorado.edu/earthlab/) and Earth Lab’s learning portal (www.earthdatascience.org).
Review of applications will begin October 18. The position will remain open until filled.
What We Can Offer
We can offer competitive salary and a comprehensive benefits package.
Benefits
The University of Colorado offers excellent benefits, including medical, dental, retirement, paid time off, tuition benefit and ECO Pass. The University of Colorado Boulder is one of the largest employers in Boulder County and offers an inspiring higher education environment. Learn more about the University of Colorado Boulder.
Be Statements
Be Driven. Be Respectful. Be Boulder.
What We Require
Ph.D. in a related field is required, such as applied mathematics, computer science, geography, ecology, environmental studies, remote sensing, or other.
Background expertise in machine learning, deep learning, artificial intelligence, and/or statistics possibly with applications to environmental data.
Applicant must have demonstrated interest and skills in one or more of the approaches described above (e.g., machine learning approaches, remote sensing, data integration across multiple sources, etc.).
A strong quantitative background is necessary.
The ability to work as part of an interdisciplinary team.
What You Will Need
Experience in, or willingness to learn, appropriate programming and data analytic tools. Ideally the candidates will have experience in programming languages (e.g., R, Python, or others), can work in different environments (e.g., Linux), and are well versed in geospatial analysis software (e.g., QGIS).
Demonstrated contributions to open science (i.e., publicly available and/or reproducible data, code, workflows, and/or tools) or willingness to contribute to open science.
Experience in integrating and analyzing large, and/or heterogeneous datasets.
Experience in working with a high performance computing or cloud computing environment is a plus (Earth Lab supports both HPC & cloud compute on AWS).
Demonstrated publication and grant-writing skills.
Team spirit and interest in interdisciplinary settings, with a willingness to engage with Earth Lab’s Analytics Hub and Education Initiative teams.
Special Instructions
To apply, please submit the following materials:
Resume or CV
Cover letter addressed to the Search Committee briefly describing your qualifications, professional goals, and specific interest in this position.
List of contact information for 3 references who will be willing to write a confidential Letter of Recommendation for you.
If you are selected as the finalist, your degree will be verified by the CU Boulder Campus Human Resources department using an approved online vendor. If your degree was obtained outside of the United States, please submit a translated version as an optional attachment.

Review of applications will begin October 18. The position will remain open until filled.

Note: Application materials will not be accepted via email. For consideration, applications must be submitted through CU Boulder Jobs.
Posting Contact Information
Posting Contact Name: Brian Johnson, Director, Earth Lab Analytics Hub
Posting Contact Email: brian.johnson-1@colorado.edu",https://www.indeed.com/viewjob?jk=4ceff7b6b6c4a3b1&from=serp&vjs=3,,22
LEAD DATA SCIENTIST,CenturyLink,"This Data Scientist role is within the Black Lotus Labs Threat Research Team. This security-focused advanced team utilizes a variety of methods to find malicious actors, botnets, and other risk types in the Internet. The team is expanding our capabilities to utilize large scale data sets in this analysis and are excited to bring new talented members on-board to join in this exciting work.
The Data Scientist is responsible for developing tools to collect, clean, analyze and manage the data used by strategic areas of the business. Employ techniques and theories drawn from mathematics, statistics, from the subdomains of machine learning, classification, cluster analysis, and data mining.
Job Description

Clearly communicate methods and conclusions with simple language and innovative visualizations to management and executives.
Work effectively on a team as well as a self-driven individual to do research and develop cutting edge and effective solutions for the business.
Provide expertise in analyzing and visualizing large, complex, and unique data sets.
Create new insights that will drive business growth and profitability in the short and long term.
Deploy analytics code with a continuous integration environment incorporating version control, build servers, and test servers.
Design and implement programs and automation to collect, mash up, process and analyze distributed real-world data.
Collaborate with cross-functional teams to understand complex business problems, build statistical models, and create predictive tools.

Qualifications
A strong applied mathematics and statistics knowledge
Experience making actionable decisions out of seemingly inconclusive data sets
Strong knowledge of supervised and unsupervised machine learning techniques and methodologies
Experience with relational and non-relational databases
Strong experience with tools for managing, analyzing, and visualizing large datasets
Programming experience with two or more of Python, Lisp, Java, Scala, R, Matlab, Golang, or C++
Creativity and persistence in locating, extracting and analyzing any and all relevant data
Problem solving versatility: making the best decisions possible given the data quality and time available
Strong analytical thinking and ability to quickly pick up new methods, tools and programming languages

Highly qualified candidates may have:
Past success in extracurricular math/science activities or competitions
Involvement through participation with community events such as meetups or security conferences related to data science
Experience with Spark and Jupyter
Knowledge of networking and telecommunications
Experience with sklearn, pandas and numpy
Knowledge of malware and network traffic analysis techniques
User level experience in a Unix-based environment
Alternate Location: US-Colorado-Broomfield
Requisition #: 216151
This job may require successful completion of an online assessment. A brief description of the assessments can be viewed on our website at http://find.centurylink.jobs/testguides/
EEO Statement
We are committed to providing equal employment opportunities to all persons regardless of race, color, ancestry, citizenship, national origin, religion, veteran status, disability, genetic characteristic or information, age, gender, sexual orientation, gender identity, marital status, family status, pregnancy, or other legally protected status (collectively, “protected statuses”). We do not tolerate unlawful discrimination in any employment decisions, including recruiting, hiring, compensation, promotion, benefits, discipline, termination, job assignments or training.
Disclaimer
The above job definition information has been designed to indicate the general nature and level of work performed by employees within this classification. It is not designed to contain or be interpreted as a comprehensive inventory of all duties, responsibilities, and qualifications required of employees assigned to this job. Job duties and responsibilities are subject to change based on changing business needs and conditions.",https://www.indeed.com/viewjob?jk=ae2f5444ce8a7737&from=serp&vjs=3,,19
