job_title,company,description,job_url,keywords_present,page_found
Building Data Scientist III,National Renewable Energy Laboratory,"Posting Title
Building Data Scientist III
.
Location
CO - Golden
.
Position Type
Regular
.
Hours Per Week
40
.
Job Description
The NREL Commercial Buildings Research Group is transforming energy through building science and integration. We are expanding the frontier of scientific knowledge that enables optimized energy use, generation, and storage in the built environment at multiple scales. Our research significantly enhances the resiliency, efficiency, and affordability of energy systems across the United States and the world. Data management, analytics, and visualization are core to our research, which often requires the generation of energy data at scale via both sensor infrastructure and physics-based simulation engines. We also leverage local and national datasets from diverse sources. Our preference is to leverage open source tools and we make substantial open sources contributions in the building energy modeling space.
The ideal candidate has experience with the design and implementation of data models, pipelines, cleaning strategies, analyses and visualizations. The data scientist should have experience with data visualization frameworks and preferably have experience synthesizing data analysis results into basic web applications. The successful applicant will work collaboratively to define problems, design solutions, implement analyses, and effectively communicate the outcomes. The hired candidate must be comfortable working across teams to remove uncertainty from project requirements and build consensus around outcomes.
.
Basic Qualifications
PhD in Computer Science, or related. Or Master's Degree in Computer Science or related and 3 or more years of research/engineering experience. Or Bachelor's Degree in Computer Science or related and 5 or more years of research/engineering experience.
.
Additional Required Qualifications
.
Preferred Qualifications
Strong communication and writing skills.
Experience with data modeling and data exchange formats, especially XSD.
Experience with big data workflow and management using tools such as Kubernetes or Docker Swarm.
Experience with software development in a scientific environment using Python, Ruby, or C++.Working knowledge of building science principles and building energy reporting terminology.
An understanding of the energy-related challenges and opportunities inherent in metering, managing, and storing building interval data.
Data science experience with related frameworks such as pyTorch, TensorFlow, scikit-learn, or various others.
Strong probability and statistics background with demonstrated expertise.
Working experience in writing quality code with unit tests and integration tests as needed.
.
Submission Guidelines
Please note that in order to be considered an applicant for any position at NREL you must submit an application form for each position for which you believe you are qualified. Applications are not kept on file for future positions. Please include a cover letter and resume with each position application.
.
EEO Policy
NREL is dedicated to the principles of equal employment opportunity. NREL promotes a work environment that does not discriminate against workers or job applicants and prohibits unlawful discrimination on the basis of race, color, religion, sex, national origin, disability, age, marital status, ancestry, actual or perceived sexual orientation, gender identity, or veteran status, including special disabled veterans.
NREL validates right to work using E-Verify. NREL will provide the Social Security Administration (SSA) and, if necessary, the Department of Homeland Security (DHS), with information from each new employee’s Form I-9 to confirm work authorization.",https://www.indeed.com/viewjob?jk=16d0fb4f64302e0b&from=serp&vjs=3,,15
Data Scientist,Bank of America,"Job Description:
This position will be responsible for enabling analysis, modeling, and optimization through producing information products. Actively involved in the research and development efforts. Primary requirement is not related to traditional programming or systems analysis skills but to the ability to create sophisticated, value-added analytic systems that support cyber crime protection and related issues of risk management, operational efficiency, regulatory compliance, and research. These systems must overcome issues of complex data (e.g., VLDB, multi-structured, big data, etc.) as well as deployment of advanced techniques (e.g., machine learning, text mining, statistical analysis, etc.) to deliver insights. Responsible for adoption of enterprise information products through clearly communicating how enterprise information products answer material banking questions leading to decisions and actions. This role possesses an advanced degree in hard science. Able to lead or work independently on complex projects and influence strategic direction.
Responsibilities:
Support key regulatory model testing, implementation, ongoing performance monitoring, and MRM documentationUse data assets to gain insights into current processes and modelsDrive processing, cleansing, and verifying the integrity of data used for analysisResearch and identify the data gaps, develop and implement remediation plan and assess the model outcome impactLead Data Quality metrics development and monitoring, internal process design and documentationExtend company’s data with third party sources of information when neededData mining, investigation and transformation
Experience / Qualifications:
5+ years of professional experience as a data scientist or related rolesAdvanced degree or equivalent experience in a quantitative discipline.Strong STEM backgroundHands on experience in Machine Learning, Statistical Modeling, Quantitative Analysis, Forecasting, Data VisualizationStrong knowledge and high proficiency in SAS, SQL, Python, etc.Attention to details and willingness to dive deeper into complex databases and sources
Shift:
1st shift (United States of America)
Hours Per Week:
40",https://www.indeed.com/viewjob?jk=a46abe69ad0756ca&from=serp&vjs=3,,11
Data Engineer (Mid and Senior),Datalere,"Data Engineer, Mid to Senior Level
Datalere team members lead by example, focus on customer needs and have a thirst to learn all they can about data analytics. Successful candidates are self-starters and never shy away from challenges.
We need team members that excel when working directly with clients to meet their goals. They understand the client's needs and requirements and build a collaborative environment to ensure a successful project delivery.
Data Engineers analyze and develop on-premises and/or cloud data and ETL solutions to solve the client's challenges. They enjoy the challenges of consulting and thrive to knock the socks off of clients
Please note that this role is vendor agnostic in regards to what ETL tools are used, so having multi vendor experience would be ideal.
Responsibilities:
Hands-on development and serve as technical expert on projects
Develop data solutions leveraging traditional and cloud product offerings from leading vendors
Develop data models to meet client needs
Develop data models to meet client needs, including transactional, third-normal form, dimensional, columnar, distributed and NoSQL
Develop ETL/ELT processes and patterns to efficiently move data
Create data visualizations, dashboards and reports as needed
Develop and scope requirements
Travel as needed (currently less than 5%)
Maintain effective communication with team and customers
Qualifications
2+ years designing and developing data analytics solutions
2+ years with RDBMS such as SQL Server, Oracle, MySQL
2+ years data warehouse, dimensional modeling design and architecture
A passion to learn and improve your skills to deliver the best possible solutions to customers
Experience with cloud based data services offered by Azure, AWS and Google
Experience with data visualization tools such as Power BI and Tableau
Previous consulting experience preferred
Degree in computer science, information technology, engineering or business
Must be authorized to work in the US. We are unable to sponsor H-1B visas at this time.
About Us
At Datalere, we work with our clients to transform their enterprise through the use of modern compute technologies and proven deployment processes providing cost effective durable solutions for the competitive world.
If you are seeking new challenges, interested in staying up to date with the latest releases and can deliver uncompromised service to our customers, then we'd like to hear from you. If you are interested and meet the above qualifications, please submit your resume and cover letter indicating your interest to join our team.",https://www.indeed.com/viewjob?jk=ab2f7b23069fe431&from=serp&vjs=3,,12
Senior Data Scientist,Vail Resorts,"Reach Your Peak at Vail Resorts. You're someone who pushes boundaries and challenges the status quo. You're brave, ambitious and passionate in everything you do. And we want you on our team. Pursue your fullest potential and never settle in the quest to deliver extraordinary guest service. Join one of the world's most innovative companies and re-imagine a mountain resort experience with us. Welcome to Vail Resorts. Reach Your Peak.
SUMMARY:

Vail Resorts is looking to hire a Senior Data Scientist to join our Data Science team. This role will be a key member of a very high-profile team that sits at the center of Vail Resorts’ strategy and has the full support of the CEO, CMO and the Executive Committee. We have a proprietary first party guest database that was built over the last 5+ years, is unmatched by any other company in the industry, and creates a robust foundation for building out impactful algorithmic solutions. This role will be a critical part of the team that will take our Data Science capabilities to the next level, developing advanced technologies that will not only uncover business insights / anomalies but also help tailor experiences for our guests that will drive sizable impact for the business (e.g. predictive Next Resort Model to drive increased return rate for our guests).
WHY THIS ROLE IS SPECIAL:

Vail Resorts is an incredibly fast-growing company at the forefront of the Travel and Tourism industry – redefining the ski industry in the 21st century
Leveraging analytics is a core pillar of Vail Resorts’ strategy moving forward – a critical driver of our success leading to a strong willingness to invest
We are a data-driven business with a proprietary guest database unmatched by any other company in the industry – a great foundation for building out analytic use cases
The opportunity to take our Data Science capabilities to the next level – on a growing team of data scientists (10+ near future state) and having significant impact on the business
Exposure to senior leaders of the business (CEO, CMO, broader Executive team) – a unique opportunity to team with our business leadership to reimagine analytics
All the free skiing / riding you and your dependents can handle – free Epic passes, discounted lodging and retail

REQUIRMENTS:

At least 3-5+ years of experience
Advanced degree in a quantitative field (Computer Science, Statistics / Math, Engineering, etc.)
Experience in design, deployment, and tuning of machine learning algorithms (supervised and unsupervised) – applications to marketing and customer insights preferred
Fluency in SQL preferred as well as development experience in at least one statistical programming language (Python, R, etc.)
Must be comfortable in the classification and assessment of the strengths and weaknesses of alternative algorithmic solutions/approaches
Demonstrated hands-on engineering and development of large-scale data/data science centered solutions (production environments preferred)
Comfortable working in a dynamic, research-oriented group with several ongoing concurrent projects
Strong communication skills including the capability to present complex results in an eloquent and easily understood manner
Strong learning agility with a relentless desire for continuous improvement and continued education - incorporating the newest ideas, technologies, and approaches to business
A brave, ambitious, and passionate professional who is comfortable in his/her own skin while also demonstrating a high level of self-awareness
We offer a variety of career opportunities at our world-class resorts and corporate headquarters near Boulder, Colorado in fields like Finance & Accounting, Human Resources, Information Technology, Legal, Public Affairs & Sustainability, Marketing, Sales & Communications and more. Our corporate team shares both a passion for the outdoors and a drive to re-imagine the mountain resort experience around the world. Learn more at www.vailresortscareers.com
Vail Resorts is an equal opportunity employer. Qualified applicants will receive consideration for employment without regard to race, color, religion, sex, national origin, sexual orientation, gender identity, disability, protected veteran status or any other status protected by applicable law.
VRIT
Requisition ID 179588",https://www.indeed.com/viewjob?jk=44f3a215eda5f5af&from=serp&vjs=3,,2
Head of Data Science,Front Door,"Company Overview
Frontdoor is a company that’s obsessed with taking the hassle out of owning a home. With services powered by people and enabled by technology, it is the parent company of four home service plan brands: American Home Shield, HSA, Landmark and OneGuard. Frontdoor serves more than two million customers across the U.S. through a network of 15,000 pre-qualified contractor firms that employ over 45,000 technicians. The company’s customizable home service plans help customers protect and maintain their homes from costly and unplanned breakdowns of essential home systems and appliances. With more than 45 years of experience, the company responds to over four million service requests annually (or one request every eight seconds). For more details, visit frontdoorhome.com .
This is the role you are looking for, if:
you interested in working at the intersection of applied quantitative research, engineering development, and data science

you have an interest in building a high-performance data science group that delightful consumer experience through solving quantitative problems

Responsibilities
Solve the supply-demand problems of service professional and home repair

model home appliances and their maintenance schedule based on 50 years of industry data

build models that take aspects of weather-related trends to predict demands of services

Create models of service assignments based on experiences by customer's interaction with service professionals

build the Data Science function at Frontdoor

Define data science strategy for Frontdoor

Lead and mentor a team of Data Scientists and Analysts

Hands-on leader, you will personally own critical initiatives.

Find new opportunities to put our data to work in service of our customers without compromising end-user privacy or security.

Partner with the Engineering organization to define the data infrastructure

Required qualifications
Excellent educational background in a quantitative field, such as Operations Research, Economics/Econometrics, or Machine Learning

Comfortable with research methodologies to address abstract business and product problems with utmost precision, while staying grounded in common sense. Makes complex problems simple

5-7 years industry experience in data analytics and quantitative modeling, with significant work experience as a technical contributor

3-5 years of startup experience

5-7 years of team leadership experience

Excellent judgment and creative problem-solving skills

Excellent written skills and interpersonal

Enjoys being a leader

Experience with common analysis tools - SQL, Python, R, etc.

Demonstrable familiarity with code and programming concepts (modeling exercise during the interview)

Self-starter and relentless personal drive to get things done

Ability to drive multiple initiatives at once, while constantly driving focus on the highest priorities

Preferred Qualifications
Ph.D. degree

Experience with operations, routing, dispatch, logistics modelization

Experience with deep learning, representation learning, convex & combinatorial optimization, hypothesis testing, causal inference, and behavioral modeling

Experience leading a distributed team, deeply embedded in multiple functions and businesses

For more than 40 years, American Home Shield has protected homeowners by providing affordable protection against inevitable home system component and appliance breakdowns. We have a network of more than 11,000 pre-screened home service contractors and 45,000 professional technicians that provide convenient, reliable expert service to our customers. At American Home Shield, we provide possibilities for career advancement and training and development opportunities. Join our team and help solve the homeowner's dilemma every day!
Job Category: Engineering",https://www.indeed.com/viewjob?jk=0b3fdfdfcf73665c&from=serp&vjs=3,,2
Data Scientist,SSB Consulting Group LLC,"Description:
Summary

This role is responsible for contributing to the use of data to make decisions and driving forward SSB’s Advanced Analytics product goals. This includes: The development and execution of new predictive modeling algorithms, the coding/development of tools that use predictive modeling to make business decisions, searching for and integrating new data (both internal and external) that improves our modeling results (and ultimately our clients’ decisions), and discovery of solutions to SSB’s and our clients’ business problems that can be solved through the use of predictive modeling.

Responsibilities


Acts as SME and uses best practices to develop statistical techniques to build models that address SSB’s and our clients’ business needs
Utilizes effective project planning techniques to break down basic and occasionally moderately complex projects into tasks and partner with product team to ensure deadlines are kept
Uses and learns a wide variety of tools and languages to achieve results.
Proficient in Python (NumPy, Pandas, scikit-learn, Keras, Tensorflow)
Experience with SQL, JSON, ETL, Cloud Storage, API’s
Experience with Docker / Kubernetes
Experience with Azure Functions
Innovates on projects by suggesting and using new modeling techniques or tools
Executes on modeling/machine learning projects effectively
Communicates findings to team and leadership ensure models are well understood and incorporated into business processes
Works with leaders to ensure the project will meet their needs
Maximizes personal professional development to ensure continuation of a personal contribution to the team and SSB.

Requirements:
Qualifications & Education


Have completed at least a Bachelor’s degree in a quantitative field such as statistics, mathematics, computer science, physics, finance or economics or a related field. Progress towards Master’s is preferred.
2 years of related experience in using statistical modeling and/or machine learning techniques to build models that have driven company decision making preferred
Experience in managing and manipulating large, complex data sets
Ability to code and develop prototypes in languages such as Python, preferred
Experience with data visualization tools (Tableau, PowerBI, matplotlib, seaborn)
Knowledge of advanced modeling techniques preferred
Demonstrated analytic agility and the ability to analyze and interpret moderate to complex concepts
Ability to provide written and oral interpretation of highly specialized terms and data, and ability to present this data to others with different levels of expertise",https://www.indeed.com/viewjob?jk=ea41a686254dfad7&from=serp&vjs=3,,2
Data Scientist,Dataiku,"Dataiku’s mission is big: to enable all people throughout companies around the world to use data by removing friction surrounding data access, cleaning, modeling, deployment, and more. But it’s not just about technology and processes; at Dataiku, we also believe that people (including our people!) are a critical piece of the equation.

We're looking for a Data Scientist to join Dataiku in our offices in New York or Denver.

Dataiku’s promise to our customers is to provide them with the software and support needed to accelerate their Data Science and Machine Learning maturity. Dataiku’s Data Science team is responsible for delivering on that promise. Internally, we call the team the DataFab, ask us about it!

As a Data Scientist at Dataiku, you will have the opportunity to participate in our customer's journey, from supporting their discovery of the platform, it's installation and configuration, to training users and co-developing data science applications, from design to deployment. You will get hands-on experience coding in multiple languages and applying the latest big data technologies to business uses cases. Our ideal candidate is comfortable learning new languages, technologies, and modeling techniques while being able to explain their work to other data scientists and clients.
Responsibilities:
Co-develop data science projects with our customers
Crunch, analyze and investigate various kinds of data, across industries and use cases
Explore new machine learning algorithms, and apply them to real-world business applications
Deploy Machine Learning models to production, and develop its integration or front-end (e.g. a predictive webapp)
Help users discover the Dataiku platform and to master its use by providing trainings to users with a wide range of backgrounds and skill levels (data science, IT, analysts, managers, etc…)
Communicate results to non-technical colleagues and clients
Provide data science expertise to customers and internally to Dataiku’s sales, marketing, and R&D teams
Requirements:
Curiosity and a desire to learn new topics and skills
Empathy for others and an eagerness to share your knowledge and expertise with your colleagues, Dataiku’s customers, and the general public
2+ years of experience with R or Python
2+ years of experience with predictive modeling
Familiarity with data visualization in Python, R or JavaScript
Understanding of relational data structures and SQL
Bonus points:
Experience with PySpark, SparkR or Scala
Experience developing WebApps
Experience building APIs
Experience with cloud infrastructures, especially Kubernetes
Passion for teaching or public speaking
Benefits:
Exposure to a wide range of enterprise customers across industries. Examples of Dataiku’s hundreds of customers include GE, Unilever, Comcast, Ubisoft, OVH, Santander, and Capgemini.
A wide diversity of projects and tasks ensures that no two days will be alike
Opportunity to contribute to the core vision of our company and product: simplify and democratize the way people work with data and use Artificial Intelligence
Exposure to the latest, open source technologies that Dataiku integrates. See our release notes for our latest developments: https://doc.dataiku.com/dss/latest/release_notes/index.html
Competitive compensation package, equity, health benefits, and paid vacation
Trips to Paris (our European HQ) and other locations worldwide for company-wide and team summits
Opportunity to work with a smart, passionate and driven team in hypergrowth mode
Dataiku has a strong culture based on key values: Transparency, Ambition, Excellence, Humility, and Empathy
To fulfill its mission, Dataiku is growing fast (having just closed a $101 million Series C round in December 2018 and looking to double in 2019), but still maintains a startup spirit. Dataiku serves its global customer base from its headquarters in New York City as well as offices in Paris, London, Munich, Singapore, and Sydney. Each of our offices has a unique culture, but underpinning local nuances, we always value curiosity, collaboration, and can-do attitudes.",https://www.indeed.com/viewjob?jk=4399b6dccc696551&from=serp&vjs=3,,2
