job_title,company,description,job_url,keywords_present,page_found
"Siri - Analytics Engineer, Data Organization",Apple,"Summary
Posted: Nov 18, 2019
Role Number: 200075041
Would you like to play a part in the next revolution in human- computer interaction? Create groundbreaking technology for large scale systems, spoken language, big data, and artificial intelligence? And work with the people who created the intelligent assistant that helps millions of people get things done — just by asking?
The vision for the Siri Data organization is to improve Siri by using data as the voice of our customers. As an Analytic Engineer on the team, you will design, implement the generation of, and analyze data that informs the development of new classes of AI/ML-driven Siri experiences.
Key Qualifications
You are a polyglot programmer who has experience with full-stack application development. Experience with iOS development (Swift, Objective C) is a plus.
You have designed and developed instrumentation of the user experience in complex software systems.
You have built robust analytic pipelines and have a keen eye for how to scale and how to automate (e.g. Kafka, Spark, Druid, Airflow).
You are a statistical thinker: you care about distributions
more than averages; you can find and investigate sources of variance; you ensure you can measure effect sizes from changes in the user experience.
You are self-motivated and curious with demonstrated creative and critical thinking capabilities and an innate drive to improve how things work.
You have a track record of working well with constraints, demonstrating creativity when they must be adhered to and demonstrating courage when they must be changed.
You have a high tolerance for ambiguity. You find a way through. You anticipate. You connect and synthesize.
You can influence decisions with excellent verbal and written communications skills.
Description
You will partner closely with Siri machine learning and engineering teams who are pushing the state of the art forward for intelligent assistants. Your work will enable them to build mental models of Siri engagement and also directly shape priorities on how Siri improves.
You will become an expert in Siri's architecture and sources of data to guide how the Siri experience is instrumented and measured.
You will build tools that enable easier, programmatic integration of insights across the Siri partner teams.
Education & Experience
We are looking for people with a track record in designing information, deriving insights, and building relationships to affect decisions. Join us, and impact hundreds of millions of customers across billions of their interactions with a personal, intelligent assistant who is available on iPhone, iPad, HomePod, Mac, Watch, CarPlay, and tv across more than 30 languages.
We are an equal opportunity employer and value diversity at our company. We do not discriminate on the basis of race, religion, color, national origin, gender, sexual orientation, age, marital status, veteran status, or disability status.
Additional Requirements
Recruit, hire and nurture people who are not only great technically but also demonstrate success in the highly collaborative, functional environment of innovation at Apple.
Lead a team while keeping them connected, collaborating, inspired; whereby they understand how their work ladders into the bigger picture, mission, and vision
Give crisp feedback to your team that balances opportunities for growth with vision to inspire.
Work in service of something larger without creating a service org. Your team can deliver what is needed but also redefine what is possible.
You are humble and lead by example.
You have compassion for your colleagues and the challenges they face. You partner to drive pragmatic progress, but can drive a controversial direction when needed.
You model detailed thinking and crisp communication.
Move up and down the ladder of abstraction and help your team do so as well. You can talk and design on technical matters but are always able to connect that work to the impact it is in service of.",https://www.indeed.com/viewjob?jk=59e08856cac3824f&from=serp&vjs=3,,4
Data Engineer,ICF,"Data Engineer

Golden, CO

Job Description:

This is a cross functional position with significant responsibility and opportunity to shape the future direction of our team. The selected candidate will work with our Data Scientists and Software Delivery Teams to code within SQL Server to collect, store, validate and process large datasets in a Microsoft SQL Server environment. This position will be part of a small analytical team working on quantitative software products and services so experience working in a product development environment is desired. Successful candidates will be very analytical with a high attention to detail in a quantitative environment to ensure a stable, repeatable, and accurate production data stream. Successful candidates will also enjoy a highly independent work environment where they can take a high level of ownership of their accomplishments.
Key Responsibilities:
Develop and execute T-SQL code to facilitate data movements and ETL processing
Develop and execute stored procedures to report on processing statuses and data conditions
Design and code workflows, create database releases, and optimize production data pipelines to ensure data accuracy
Perform hands on data research to provide insights and uncover potential data issues
Map data feeds and combine them with third party content ensuring consistency
Develop data processing TSQL Code with a focus on consistency, reliability, and accuracy
Develop and code operational processes to automatically report on data conditions and KPIs during processing
Be a part of fast moving development teams using agile methodologies
Qualifications
8+ years of professional database solution development with Microsoft SQL Server
Strong Analytical and reasoning skills that result in clear, robust, and accurate solutions
Strong data debugging skills
5+ years of experience working within the full lifecycle SDLC as part of a software product and operations team environment
Experience developing SQL scripts, data processing processes, and performance tuning quantitative queries
Superior organizational and end to end delivery skills in an Agile environment
Ability to manage multiple tasks and shifting priorities with proactive communication in mind
Ability to maintain strong working relationships with development and business teams based on a proactive communication style

Additional Preferred Skills/Experience:
Experience with PowerShell scripting
Ability to work in a distributed team environment
Experience working on quantitative software products
An outstanding academic record with a focused on Energy, Science, Math, and Engineering or similar.
Professional Skills:
Excellent listening, interpersonal, written, oral, and phone communication skills
Highly self-motivated and self-directed to solve complex technical problems
Ability to exercise independent judgment
Builds and maintains relationships with stakeholders to ensure buy-in and adoption of technology solutions
Self-motivated to continuously improve technical and professional skills
Ability to effectively prioritize and execute tasks
Working at ICF
Working at ICF means applying a passion for meaningful work with intellectual rigor to help solve the leading issues of our day. Smart, compassionate, innovative, committed, ICF employees tackle unprecedented challenges to benefit people, businesses, and governments around the globe. We believe in collaboration, mutual respect, open communication, and opportunity for growth. If you’re seeking to make a difference in the world, visit www.icf.com/careers to find your next career. ICF—together for tomorrow.
ICF is an equal opportunity employer that values diversity at all levels. (EOE – Minorities/Females/ Protected Veterans Status/Disability Status/Sexual Orientation/Gender Identity)
Reasonable Accommodations are available for disabled veterans and applicants with disabilities in all phases of the application and employment process. To request an accommodation please email icfcareercenter@icf.com and we will be happy to assist. All information you provide will be kept confidential and will be used only to the extent required to provide needed reasonable accommodations. Read more about non-discrimination: EEO is the law and Pay Transparency Statement .
Golden, CO (CO15)",https://www.indeed.com/viewjob?jk=6675e233538a71b2&from=serp&vjs=3,,3
Data Analyst Intern,ViaSat,"Bigger challenges. Bolder ideas. Global impact. At Viasat, we're on a mission to deliver connections with the capacity to change the world. We're the company behind the world's fastest satellite internet service, with technology that's helping to bridge the digital divide and improve life for our customers around the globe. By providing powerful new ways for people to connect with one another, gain greater access to education, entertainment, medical research, commerce, and much more, our team is empowering millions of customers worldwide.

We're growing rapidly and looking for passionate, innovative professionals to join our team and connect the world to more. You'll work in a collaborative and inclusive environment that values diverse perspectives and continuous learning, and provides industry-leading benefits with unmatched opportunities for career growth. Our team is fearless in pursuit of new ideas and uncompromising in our quest to become the world's first truly global Internet Service Provider. Interested in joining our mission? Take a look at career opportunities at Viasat today.

Job Responsibilities
Looking for an environment that encourages collaboration and welcomes fresh ideas? As a cutting-edge company, Viasat empowers employees to make meaningful contributions in dynamic team environments. If you’re interested in a summer internship that can provide a stepping stone toward achieving your goals, Viasat’s intern program is for you!
As a Data Analyst, you will work with Big Data on network performance, using tools to manipulate diverse real-world data and develop complex data visualizations; use data-driven metrics to create visibility into network performance, to mine data, and solve problems. You will learn and practice Agile methodologies.

Requirements
Currently pursuing a Bachelor's degree or higher in Data Science, Mathematics, Statistics and/or related field
Knowledge in Data Science
Experience Creating Data Visualizations
Data Wrangling Skills
Python and SQL skills
Able to commit to a 10-12 week internship
Preferences",https://www.indeed.com/viewjob?jk=6b78ec8dcbdd9d3e&from=serp&vjs=3,,2
Data Science Pod Leader,Dataiku,"Dataiku’s mission is big: to enable all people throughout companies around the world to use data by removing friction surrounding data access, cleaning, modeling, deployment, and more. But it’s not just about technology and processes; at Dataiku, we also believe that people (including our people!) are a critical piece of the equation.

We're looking for a strong people leader to manage one of several Data Science teams in New York and Denver.
Dataiku’s promise to our customers is to provide them with the software and support needed to accelerate their Data Science and Machine Learning maturity. Dataiku’s Data Science team is responsible for delivering on that promise. Internally, we call the team the DataFab, and it is structured as small pods (3 to 6 people per pod) within a given region. As the team grows, we spin out new pods, elevating new leaders as we go.

As a Pod Leader, you will oversee the work and career development of the Data Scientists within your pod. While strong technical skills are needed to coach the members of your pod appropriately, this is a people-management position first and foremost, and candidates should be motivated by that aspect of the job.

Dataiku will support the growth of the DataFab pod leaders into their management responsibilities through ongoing professional training, the creation of communities of practice for new managers, and other initiatives currently being defined.
Responsibilities:
Serve as the direct manager for a team of 2 to 5 Data Scientists
Oversee the weekly staffing of the members of your pod, ensuring that their work matches their career development aspirations insofar as possible
Work with clients and your team members to scope client needs, formalizing them in Statements of Work
Oversee the technical quality of your team’s work, and ensure that it adheres to Dataiku’s expectations for excellence
Coordinate with the leaders of other pods and teams within your region to ensure that customer needs are being met
Conduct performance reviews and lead compensation discussions with your pod
Requirements:
A passion for selflessly leading a team, and helping each member reach their career objectives
Empathy for others and an eagerness to share your knowledge and expertise with your colleagues, Dataiku’s customers, and the general public
3+ years of experience with R or Python
3+ years of experience with predictive modelingFamiliarity with data visualization in Python, R or JavaScript
Understanding of relational data structures and SQL
Bonus Points for any of these:
Experience with PySpark, SparkR or Scala
Experience developing WebApps
Experience building APIs
Experience with cloud infrastructures, especially Kubernetes
Passion for teaching or public speaking
Benefits:
Develop your skills as a manager, while maintaining a foot strongly in the technical realm
Exposure to a wide range of enterprise customers across industries. Examples of Dataiku’s hundreds of customers include GE, Unilever, Comcast, Ubisoft, OVH, Santander, and Capgemini.
Opportunity to contribute to the core vision of our company and product: simplify and democratize the way people work with data and use Artificial Intelligence
Exposure to the latest, open source technologies that Dataiku integrates. See our release notes for our latest developments: https://doc.dataiku.com/dss/latest/release_notes/index.html
Competitive compensation package, equity, health benefits, and paid vacation
Trips to Paris (our European HQ) and other locations worldwide for company-wide and team summits
Opportunity to work with a smart, passionate and driven team in hypergrowth mode
Dataiku has a strong culture based on key values: Transparency, Ambition, Excellence, Humility, and Empathy
To fulfill its mission, Dataiku is growing fast (having just closed a $101 million Series C round in December 2018 and looking to double in 2019), but still maintains a startup spirit. Dataiku serves its global customer base from its headquarters in New York City as well as offices in Paris, London, Munich, Singapore, and Sydney. Each of our offices has a unique culture, but underpinning local nuances, we always value curiosity, collaboration, and can-do attitudes.",https://www.indeed.com/viewjob?jk=808714618829853c&from=serp&vjs=3,,1
Data Engineer,"RE/MAX, LLC","RE/MAX, LLC is looking for a Data Engineer to support data ingestion, movement and warehousing using cloud native tools. This role will support data integration for business intelligence solutions and collaborate with API developers to ensure consistency and accuracy across the data platform. This role will also maximize RE/MAX assets by eliminating redundant jobs/services and support establishing standards for information delivery enterprise wide. Success in this role is bringing technical expertise to a new data platform and help build a solution that scales for optimal performance and cost.

Responsibilities include:

Prototype data solutions to enable warehousing, event driven data capture, and data modeling
Implement solutions using ELT/ETL and/or combinations of automation tools
Develop re-usable data solution patterns to enable quick to market data assets
Analyze & profile business data in structured and unstructured formats
Design conceptual and logical data models, create metadata definitions, and create source-to-target mapping
Evaluate tools and emerging technologies within the data ecosystem to push innovation
Collaborate with other developers in creating scalable solutions
The ideal candidate will demonstrate the following abilities and characteristics:

Basic experience working within an Amazon Web Services (AWS) environment
Proficiency developing SQL queries
Basic Python knowledge
Analytical problem solver
Quickly build credibility and trust with internal customers
Demonstrate work ethic based on a strong desire to exceed expectations

Basic qualifications:

BS/BA degree in a quantitative field (Mathematics, Engineering, Sciences, Operations Research)
1-2 years of SQL experience
Ability to write basic Python tasks
Proficiency acquiring data from API’s
Familiarity, or ability to quickly learn new advances in tools and technologies like Snowflake, Airflow, AWS S3/Aurora, Kinesis and Tableau

Preferred qualifications:

Familiarity with Terraform
Ability to consistently meet deadlines, and provide well-vetted recommendations
Advanced problem-solving skills for difficult and complex issues
45 Years of Outstanding Agents & Outstanding Results. At RE/MAX we have created a world-class, industry leading organization that has become the #1 real estate brand in the world. Every RE/MAX team and department makes an important contribution to our story. That's why we offer a wide range of advantages from excellent benefits to competitive compensation; from exceptional training and growth opportunities to a safe and invigorating work environment. Expect more! Build a career where your contribution is valued and you can work with some of the brightest, gifted and fun employees! Join the RE/MAX team today!

RE/MAX LLC, Motto Mortgage and booj are an equal opportunity employer committed to diversity and inclusion, as well as non-discrimination in employment. All qualified applicants receive consideration without regard to race, color, religion, gender, sexual orientation, national origin, age, veteran status, disability unrelated to performing the essential task of the job or other legally protected categories. All persons shall be afforded equal employment opportunity.",https://www.indeed.com/viewjob?jk=912c2e3ce90af69c&from=serp&vjs=3,,5
Data Engineer,Colorado Community Managed Care Network,"Location: 1212 S Broadway, Denver, CO 80210

Category: Full time, Exempt

Salary Range: (DOE)

Reports To: CEO
Colorado Community Managed Care Network (CCMCN) is comprised of Colorado’s Community Health Centers with over 190 clinic sites (including school based clinics, pharmacies, and mobile units). CCMCN was founded as a non-profit organization in 1994 to respond pro-actively to the advent of mandatory Medicaid managed care, and has evolved to a multi-faceted organization that serves its members in areas where a network solution optimizes collaborative endeavors. Areas of focus include population health, accountable care, shared services, health information technology and clinical quality improvement programming. CCMCN’s vision is that all Coloradoans have access to high quality, integrated, accountable health care.

CCMCN is a one-third founding partner in Colorado Access, a health plan focusing on Medicaid, Medicare and Child Health Plan Plus (CHP+) and CCMCN has been a HRSA-supported Health Center Controlled Network (HCCN) since 1995. CCMCN is governed by a Board of Directors comprised of organizational representatives from each of its health center members as well as representation from Colorado Community Health Network (CCHN). The Board membership includes clinician representatives, elected at-large, and carries out policy and decision-making duties.

Position Description:
The Data Operations department provides data management, integration, and reporting services for multiple external and internal consumers. The Data Engineer will be responsible for all aspects of data management that support CCMCN’s production services. Candidate must have experience in Microsoft SQL database development, data integration, ETL (extract, transform and load) tools and methods, analytics, reporting, and documentation.

Essential Functions:
Provide development and maintenance support for data integrations between systems.
Provide development and maintenance support for the EDW and supporting databases.
Provide automated solutions whenever possible and proactively suggest alternative solutions.
Assist in the development of new databases and associated processes as necessary.
Provide data analytics report development for specific projects as needed.
Develop data validation reports and analysis where applicable.
Develop technical documentation of data integrations and processes.
Communicate and collaborate with other team members and clients to develop innovative data solutions.
Utilize up-to-date knowledge of database and data quality best practices to produce effective solutions.
Remain knowledgeable in healthcare data standards, measures and code sets as well as applicable data privacy practices and legal requirements.
Required Skills and Experience:
Experience working in a Microsoft SQL Server environment, especially with SSIS, stored procedures and query development.
Knowledge of data warehousing best practices, concepts and processes.
Strong analytical and problem-solving skills, with demonstrated change management experience.
Demonstrated ability to set and meet project timelines and deliverables.
Effective interpersonal and communications skills with the ability to interact with various levels of personnel.
Must be flexible, organized, self-directed, able to prioritize multiple tasks, and able to manage a full workload.
Experienced in Microsoft Office and Microsoft Operating Systems.
Must be able to work in CCMCN's main office and travel to all required meetings
Fluency in written and spoken English.
Additional Preferred Skills:
Strong business and technical writing abilities.
Knowledge of healthcare data standards such as HL7, CCD, CCR and claims data.
Knowledge of standard healthcare code sets like LOINC, ICD9/10, CPT4 and SNOMED.
Knowledge of IHI triple aim, clinical quality improvement, and primary care operations/workflow.
Ability to stay current on healthcare reporting requirements such as UDS, PQRI, NQF, Meaningful Use and Patient Centered Medical Home.
Ability to attend conferences and workshops for further education to expand and improve management skills.
CCMCN is an equal opportunity employer offering a generous benefit package, generous vacation and holiday schedule, casual work environment, and a flexible work schedule.

TO APPLY:
Please submit a resume and cover letter by email to jobs@ccmcn.com.
PLEASE INCLUDE THE JOB TITLE IN THE SUBJECT OF THE EMAIL.
No phone calls please.",https://www.indeed.com/viewjob?jk=b0bf56f529c57a62&from=serp&vjs=3,,10
DATA ENGINEER,Decentrix,"Decentrix is offering an exciting opportunity to an individual with the right skill set and background to join our elite team and work with the most advanced Media Advertising Enhancement/Optimization Technologies. You would be using your business, technical & development skills in an extremely fast paced environment providing services to forward thinking media corporations. See www.bianalytix.com for more information.
Position Responsibilities:
Design, Develop and Maintain Data Storage and Data Analytics Products, Systems and Solutions for clients in the Media Industry
Develop, Enhance & Configure data transformation and storage solutions in support of our product offerings
Work closely with other internal engineering teams focused on front-end and back-end APIs development and configuration in direct support of various products
Work closely with internal product and project management teams to design and prioritize features and their associated delivery timelines
Diagnose and correct system and product faults, designing & implementing solutions to correct
Technical Proficiencies
Scala Language development with experience in full stack testing
Apache Spark and distributed data processing methodologies
T-SQL / PL SQL Development
Complex data processing methodologies
Massive scale data processing methodologies
Amazon AWS technologies and products (ECS, EC2, EMR, S3, etc.)
Linux
Docker image development & container execution
Advanced knowledge of RDBMS systems and associated storage optimization techniques
Analytic data structure knowledge and experience
Working knowledge of software engineering and applying database methodologies, techniques, and tools
Personal
The experience in the design of data storage and data transformation processes to leverage and analyze complex data relationships
The skills to quickly diagnose and solve technical problems associated to large data solutions and the associated technologies
Interest and ability to work at the technical installation level with major media corporations
Maturity to manage task associated to products and/or services to an installation contract
Excellent communication skills, including good verbal and written abilities",https://www.indeed.com/viewjob?jk=8dc38b19f64e3230&from=serp&vjs=3,,10
